{
  "id": "products-new--partner-search",
  "kind": "popup",
  "parentId": "products-new",
  "route": null,
  "title": {
    "value": "거래처 검색",
    "evidence": "src/main/webapp/WEB-INF/jsp/popup/partners.jsp:8"
  },
  "purpose": {
    "value": "거래처명으로 거래처를 검색해 상품 등록·수정 화면의 거래처 항목에 채웁니다",
    "evidence": "src/main/webapp/WEB-INF/jsp/popup/partners.jsp:8-25",
    "confidence": "high"
  },
  "roles": [
    {
      "value": "영업담당",
      "evidence": "src/main/java/sample/Accounts.java:12",
      "confidence": "high"
    },
    {
      "value": "관리자",
      "evidence": "src/main/java/sample/Accounts.java:13",
      "confidence": "high"
    }
  ],
  "sections": [],
  "fields": [
    {
      "label": "거래처명",
      "type": "text",
      "required": false,
      "evidence": "src/main/webapp/WEB-INF/jsp/popup/partners.jsp:10",
      "confidence": "high"
    }
  ],
  "actions": [
    {
      "label": "검색",
      "effect": "거래처명이 들어 있는 거래처만 보여 줍니다",
      "evidence": "src/main/webapp/WEB-INF/jsp/popup/partners.jsp:12",
      "confidence": "high"
    },
    {
      "label": "선택",
      "effect": "고른 거래처를 상품 화면의 거래처 항목에 채우고 창을 닫습니다",
      "evidence": "src/main/webapp/WEB-INF/jsp/popup/partners.jsp:16",
      "confidence": "high"
    }
  ],
  "messages": [
    {
      "text": "검색 결과가 없습니다.",
      "when": "검색어에 맞는 거래처가 없을 때",
      "evidence": "src/main/webapp/WEB-INF/jsp/popup/partners.jsp:19"
    }
  ],
  "unknowns": [],
  "readFiles": [
    "src/main/webapp/WEB-INF/jsp/popup/partners.jsp",
    "src/main/java/sample/PartnerController.java",
    "src/main/webapp/WEB-INF/jsp/products/form.jsp"
  ],
  "sourceHash": "sha256:97d6d0f7678a7e609c4f1c49a7f7bfb4517f1818081a9cba7a9ace9b0ab6df7b"
}
