{
  "id": "orders-edit",
  "kind": "page",
  "route": "/Orders/Edit.aspx",
  "title": {
    "value": "주문 등록",
    "evidence": "Orders/Edit.aspx:4"
  },
  "menuPath": {
    "value": [
      "주문관리",
      "주문 등록"
    ],
    "evidence": "Web.sitemap:6"
  },
  "purpose": {
    "value": "새 주문을 등록하거나, 주소에 주문번호(id)가 있으면 기존 주문을 불러와 수정합니다",
    "evidence": "Orders/Edit.aspx.cs:6-22",
    "confidence": "high"
  },
  "roles": [],
  "sections": [
    {
      "title": "신규 등록(주소에 id 없음)",
      "evidence": "Orders/Edit.aspx.cs:6"
    },
    {
      "title": "주문 수정(주소에 id 있음)",
      "evidence": "Orders/Edit.aspx.cs:17"
    }
  ],
  "fields": [
    {
      "label": "거래처",
      "type": "text",
      "required": true,
      "evidence": "Orders/Edit.aspx:5",
      "confidence": "high"
    },
    {
      "label": "납기일",
      "type": "date",
      "required": true,
      "evidence": "Orders/Edit.aspx:8",
      "confidence": "high"
    },
    {
      "label": "수량",
      "type": "number",
      "required": false,
      "evidence": "Orders/Edit.aspx:11",
      "confidence": "low"
    },
    {
      "label": "비고",
      "type": "textarea",
      "required": false,
      "evidence": "Orders/Edit.aspx:14",
      "confidence": "high"
    }
  ],
  "actions": [
    {
      "label": "저장",
      "effect": "입력값을 검사해 주문을 저장하고 주문 목록으로 이동합니다",
      "navigatesTo": "orders-list",
      "evidence": "Orders/Edit.aspx:16",
      "confidence": "high"
    },
    {
      "label": "취소",
      "effect": "저장하지 않고 주문 목록으로 돌아갑니다",
      "navigatesTo": "orders-list",
      "evidence": "Orders/Edit.aspx:17",
      "confidence": "high"
    }
  ],
  "messages": [
    {
      "text": "거래처를 입력하세요.",
      "when": "거래처를 비우고 저장했을 때",
      "evidence": "Orders/Edit.aspx:7"
    },
    {
      "text": "납기일을 입력하세요.",
      "when": "납기일을 비우고 저장했을 때",
      "evidence": "Orders/Edit.aspx:10"
    },
    {
      "text": "수량은 1 이상 9999 이하로 입력하세요.",
      "when": "수량이 범위를 벗어났을 때",
      "evidence": "Orders/Edit.aspx:13"
    }
  ],
  "unknowns": [
    "수량을 비우면 범위 검사(RangeValidator)를 건너뛰어 저장 중 오류가 날 수 있습니다"
  ],
  "readFiles": [
    "Orders/Edit.aspx",
    "Orders/Edit.aspx.cs",
    "App_Code/OrderRepository.cs",
    "Site.Master"
  ],
  "sourceHash": "sha256:42c7ab97fcc0ce25dab86331896590b1c78518ce152c00db4e6604cc254cb4f7"
}
