{
  "id": "products",
  "kind": "page",
  "route": "/products",
  "title": {
    "value": "상품 목록",
    "evidence": "src/main/webapp/WEB-INF/jsp/products/list.jsp:9"
  },
  "menuPath": {
    "value": [
      "상품관리",
      "상품 목록"
    ],
    "evidence": "src/main/webapp/WEB-INF/jsp/common/nav.jsp:6"
  },
  "purpose": {
    "value": "상품명이나 거래처로 상품을 검색하고 상품 상세 화면으로 이동합니다",
    "evidence": "src/main/webapp/WEB-INF/jsp/products/list.jsp:9-28",
    "confidence": "high"
  },
  "roles": [
    {
      "value": "영업담당",
      "evidence": "src/main/java/sample/Accounts.java:12",
      "confidence": "high"
    },
    {
      "value": "관리자",
      "evidence": "src/main/java/sample/Accounts.java:13",
      "confidence": "high"
    }
  ],
  "sections": [],
  "fields": [
    {
      "label": "검색어",
      "type": "text",
      "required": false,
      "evidence": "src/main/webapp/WEB-INF/jsp/products/list.jsp:12",
      "confidence": "high"
    }
  ],
  "actions": [
    {
      "label": "검색",
      "effect": "검색어가 상품명이나 거래처명에 들어 있는 상품만 보여 줍니다",
      "evidence": "src/main/webapp/WEB-INF/jsp/products/list.jsp:14",
      "confidence": "high"
    },
    {
      "label": "상품명",
      "effect": "목록의 상품명을 누르면 상품 상세 화면으로 이동합니다",
      "navigatesTo": "products-id",
      "evidence": "src/main/webapp/WEB-INF/jsp/products/list.jsp:20",
      "confidence": "high"
    },
    {
      "label": "새 상품 등록",
      "effect": "상품 등록 화면으로 이동합니다",
      "navigatesTo": "products-new",
      "evidence": "src/main/webapp/WEB-INF/jsp/products/list.jsp:28",
      "confidence": "high"
    }
  ],
  "messages": [
    {
      "text": "등록되었습니다.",
      "when": "상품을 등록하고 목록으로 돌아왔을 때",
      "evidence": "src/main/java/sample/ProductController.java:46"
    },
    {
      "text": "삭제되었습니다.",
      "when": "상품을 삭제하고 목록으로 돌아왔을 때",
      "evidence": "src/main/java/sample/ProductController.java:86"
    },
    {
      "text": "조건에 맞는 상품이 없습니다.",
      "when": "검색 결과가 없을 때",
      "evidence": "src/main/webapp/WEB-INF/jsp/products/list.jsp:27"
    }
  ],
  "unknowns": [],
  "readFiles": [
    "src/main/webapp/WEB-INF/jsp/products/list.jsp",
    "src/main/webapp/WEB-INF/jsp/common/nav.jsp",
    "src/main/java/sample/ProductController.java",
    "src/main/java/sample/ProductStore.java"
  ],
  "sourceHash": "sha256:15d0aeee9ca8c88d966ac1bbd44abe407008ed54be16e7ba75ecb8b25bed9c98"
}
