{
  "id": "login",
  "kind": "page",
  "route": "/login",
  "title": {
    "value": "로그인",
    "evidence": "app/login/page.tsx:8"
  },
  "purpose": {
    "value": "아이디와 비밀번호로 시스템에 로그인한다",
    "evidence": "app/login/page.tsx:9-20",
    "confidence": "high"
  },
  "roles": [],
  "sections": [],
  "fields": [
    {
      "label": "아이디",
      "type": "text",
      "required": true,
      "evidence": "app/login/page.tsx:11",
      "confidence": "high"
    },
    {
      "label": "비밀번호",
      "type": "password",
      "required": true,
      "evidence": "app/login/page.tsx:15",
      "confidence": "high"
    }
  ],
  "actions": [
    {
      "label": "로그인",
      "effect": "계정을 확인하고 대시보드로 이동한다. 계정이 틀리면 오류 메시지를 표시한다",
      "navigatesTo": "home",
      "evidence": "app/login/page.tsx:19",
      "confidence": "high"
    }
  ],
  "messages": [
    {
      "text": "아이디 또는 비밀번호가 올바르지 않습니다.",
      "when": "아이디 또는 비밀번호가 틀렸을 때",
      "evidence": "app/login/page.tsx:18"
    }
  ],
  "unknowns": [],
  "readFiles": [
    "app/login/page.tsx",
    "app/login/actions.ts",
    "lib/auth.ts"
  ],
  "sourceHash": "sha256:9b5b696744b5f3a09799dfef6109cc5099c5f642c0101d322560b1a84ce5f9ee"
}
