{
  "id": "login",
  "kind": "page",
  "route": "/login",
  "title": {
    "value": "로그인",
    "evidence": "src/main/webapp/WEB-INF/jsp/login.jsp:8"
  },
  "purpose": {
    "value": "아이디와 비밀번호로 시스템에 로그인합니다",
    "evidence": "src/main/webapp/WEB-INF/jsp/login.jsp:8-15",
    "confidence": "high"
  },
  "roles": [],
  "sections": [],
  "fields": [
    {
      "label": "아이디",
      "type": "text",
      "required": true,
      "evidence": "src/main/webapp/WEB-INF/jsp/login.jsp:11",
      "confidence": "high"
    },
    {
      "label": "비밀번호",
      "type": "password",
      "required": true,
      "evidence": "src/main/webapp/WEB-INF/jsp/login.jsp:13",
      "confidence": "high"
    }
  ],
  "actions": [
    {
      "label": "로그인",
      "effect": "계정을 확인하고 대시보드로 이동합니다. 계정이 틀리면 오류 메시지를 표시합니다",
      "navigatesTo": "home",
      "evidence": "src/main/webapp/WEB-INF/jsp/login.jsp:15",
      "confidence": "high"
    }
  ],
  "messages": [
    {
      "text": "아이디 또는 비밀번호가 올바르지 않습니다.",
      "when": "아이디 또는 비밀번호가 틀렸을 때",
      "evidence": "src/main/java/sample/LoginController.java:29"
    }
  ],
  "unknowns": [],
  "readFiles": [
    "src/main/webapp/WEB-INF/jsp/login.jsp",
    "src/main/java/sample/LoginController.java",
    "src/main/java/sample/Accounts.java"
  ],
  "sourceHash": "sha256:0e4815f0b963c9c2398db352cbcc897c706b76558f2724296716a450275d7be3"
}
